full_text,user,location,date,tweet_id,number_rt,number_likes,id_key_word
" Hace 6 años nació @somosmovilidad para promover la movilidad sostenible en la región. Un hecho irrefutable: en el Valle de San Nicolás cabe 3 veces el conglomerado urbano que se forma en el Valle de Aburrá entre Bello y Envigado, incluyendo a Medellín.",AndresJRendonC,Colombia,2022-05-17 17:22:20,1526614104533830000,6,22,1
 @MetrodeQuito @efrainbastidasz En el Metro de Medellín estamos muy emocionados con esta posibilidad. Queremos que todos los Quiteños puedan disfrutar cuanto antes su Metro 🚇 y todos los beneficios de la movilidad sostenible ♻️.,metrodemedellin,"Medellín, Colombia",2022-05-16 23:25:38,1526343144304000000,1,24,1
" Estuvimos en Medellín visitando el @Areametropol para intercambiar experiencias con el experto de #LEVE, Florencio Cuervo, sobre la agenda de movilidad sostenible con el objetivo de apoyar el desarrollo de la Política Metropolitana de Movilidad Sostenible y Eléctrica🚗🌎🚴",UKinColombia,Colombia,2022-05-16 20:45:19,1526302800996700000,8,33,1
" En Medellín ya funciona una flota 100 % eléctrica para la Línea 2 de Metroplús, la cual atraviesa la Zona Urbana de Aire Protegido - ZUAP del Centro. Desde la @sttmed apostamos por la Movilidad Sostenible y la consolidación de la #ecocidad.",marcelapedroza,Medellin - Colombia,2022-05-16 17:18:07,1526250657711370000,0,0,1
 @anabelen20201 @ImparablesEc @andreflores_a @EmilioJDom @TavoAndre @selenelo1711 @bianquirebeca @eduandinoe @norrisviajando Estuve en el corredor del Paseo La Reforma. Concuerdo contigo que Medellín es un buen referente a seguir en cuanto a movilidad sostenible.,WilsonMerinoR,Ecuador,2022-05-13 16:11:31,1525146733801620000,0,3,1
" Empresarios de @upbcolombia participaron en uno de los eventos más importantes en temas de emprendimiento realizado en Medellín @todostartups . BeeData, Lola Movilidad Sostenible y Diido. @cdeupb",UPBBogota,,2022-05-12 15:10:59,1524769108738430000,2,2,1
" @VaneGonzalezMon @QuinteroCalle @juanduquega @camivillamizar @AlcaldiadeMed @AndreeUribeM @Karen_delgadom Que chevere para la Dama. De verdad Medellín con tantas necesidades de gestión por las calles con indigentes o vias , etc. y usted se paga un curso de inglés? No sabia que ya en Medellín se dejo el español. Se hubiera hecho un curso mejor de servicios públicos y hubiera ayudado +",betitoarias26,,2022-05-18 03:05:18,1526760815486960000,0,0,3
" @estebanrestre @QuinteroCalle Jajajajaja y en que Medellín vive usted? Pudriéndonos con las basuras, jardines vueltos matorrales, el mismo metro de siempre colapsado…. Y Epm fue algo de Duque. Por cierto qué pasó con el congelamiento de las tarifas de los servicios públicos?",DianaVanegasJ,Medellin,2022-05-18 01:45:46,1526740798506660000,0,0,3
" @estebanrestre @QuinteroCalle Dijo que iba a congelar las tarifas de los servicios públicos….. oh sorpresa!!, hace dos meses subieron las tarifas. Pregunta: por donde pasa el metro subterráneo y el metro ligero en Medellín??",Juan_Tamayo,"Bogota, Colombia ",2022-05-17 21:47:17,1526680781774590000,1,1,3
" @NoticiasCaracol Los servicios públicos en Medellín, están por las nubes, asfixiados cada vez mas, no alcanza el dinero!",AnaMaraSnchezT3,,2022-05-17 20:36:07,1526662871572260000,0,0,3
" Con dinero casi todas las ciudades son agradables para vivir. Ahora, en conjunto a clima,vías,oferta de entretenimiento,comida y tamaño mas cobertura servicios públicos y salud pues: Bucaramanga Medellin Villavicencio",Sveralopez,Avenida Siempre Viva 742,2022-05-17 17:07:25,1526610351688660000,0,6,3
 Allá en Medellín Los servicios públicos Que el suspendido @QuinteroCalle prometió rebajar Es verdad han subido el doble Esta cuenta que antes llegaba entre $ 690.000 y $ 750.000 miren este mes cuanto a llegado @QuinteroCalle Medellín te pregunta.......,Ciclope2021,algún lugar del mundo ,2022-05-17 02:13:16,1526385329548280000,1,0,3
" @MARTOLO13 @QuinteroCalle Si allá en Medellín llueve aquí en Bogotá no escampa, los servicios públicos más caros y la calidad de vida también, de ñapa la inseguridad es la orden del día , pero no prioridad de la alcaldesa “cuidadora”",moni_castillo19,Bogotà ,2022-05-16 17:25:35,1526252536126130000,0,1,3
 En Medellín interesante uso de la tecnología para georeferenciar los problemas de servicios públicos. #DesarrolloLocal #CalidadDeVida,engelbertrivero,"Carabobo, Venezuela",2022-05-16 11:04:39,1526156671243930000,3,1,3
" @e_duperly Quintero prometió congelar los servicios públicos y no lo hizo. Uribista de closet, hablas de agua y no vives en Medellín.",HECIF1913,,2022-05-15 19:54:16,1525927566477040000,0,2,3
 1.418 bienes patrimoniales de Prado Centro pagarán menos servicios públicos por nueva estratificación @monpabon #medellinrural #comunas #medellin #corregimientos #webstories #comunasdemedellin @alcaldiademed,ComunasMed,Medellin,2022-05-15 19:30:00,1525921458261740000,1,1,3
 @miapelaez Correcto.. Promediaba 1969: egregia Empresa de Servicios Públicos de Medellín E.S.P lo incluye en una cadena de proyectos de aprovechamiento del potencial energético del río Cauca.. Para que llegue un sinvergüenza a desdibujar lo que ha sido orgullo de la Ingeniería Antioqueña.,AlvaroAmjs,Envigado,2022-05-15 11:29:48,1525800612654360000,1,1,3
" No se que es más caro, un Ferrari, o los servicios públicos de Medellín. Que cosa tan hpta.",Carlos_2091,Medellin,2022-05-14 22:26:26,1525603471398950000,0,0,3
" @EnriquePenalosa Si dr. Peñaloza. Los jóvenes de Medellín fueron los que metieron a Pinturita en la Alcaldía. Y ahora los padres de ellos, pagando los servicios públicos más caros de Colombia.",Mariaterpo1,,2022-05-14 20:23:51,1525572621579980000,1,5,3
" Uno ve a los alcaldes en Ucrania ya reconstruyendo sus ciudades, reparando servicios públicos sin aún retirarse las tropas del asesino del Kremlin y ve al ex alcalde de Medellín chillando por una justa suspensión. Cómo irá a ser cuando lo destituyan?",AngelaZuluagaT,Colombia,2022-05-14 17:59:17,1525536239935540000,0,0,3
" Se ve claramente que tienen hambre, vienen por la joya de la corona. Vienen por la plata de los servicios públicos de medellin",johnjairogonz13,,2022-05-13 18:53:28,1525187487399920000,1,0,3
" Alcalde Encargado de Medellín, Juan Camilo Restrepo, es recibido con abucheos por funcionarios de la Empresa de Servicios Públicos de Medellín ( EPM ). @QuinteroCalle invitó a su Gabinete y Ciudadanía a no obedecerle al alcalde encargado.",EsperanzaVargaQ,Colombia,2022-05-13 18:19:58,1525179056953640000,2,2,3
" Empresas Públicas de Medellín es la empresa de servicios públicos más grande del país. Provee agua potable a 1.6 millones de colombianos y energía a 8.5 millones. Tiene cerca de 24 mil trabajadores. Quintero y Duque deben a sacar a EPM de su pelea, 50 locos gritando no son EPM.",AndresTrigos,Colombia ,2022-05-13 16:52:47,1525157117778330000,3,13,3
" @MirandaBogota @QuinteroCalle ¿ Las mismas jugaditas de Quintero? Señora Miranda, el alcalde de Medellín llegó a la Alcaldía prometiendo rebajar los servicios públicos, adicional a eso pasados dos años, la ciudad paga los servicios más caros de toda Colombia",alejovr90,,2022-05-13 13:21:17,1525103892865950000,2,2,3
 @felipesancheztv Hoy pague los servicios públicos más caros de mi vida @EPMestamosahi tengo una rabia la hp... algo me dice que este ladrón @QuinteroCalle tiene de caja las empresas publica de medellin 😡,juansebas0327, Colombia ,2022-05-13 03:57:54,1524962110710720000,0,0,3
" Medellin ha avanzado más q’otras ciudades en temas sociales,servicios públicos,educación etc.por la unión entre lo público,lo privado,ONGs y centros educativos.S’equivoca Quintero en criticar al GEA q’ ha sido actor central en El Progreso de nuestra ciudad.Ej. de ética y civismo.",nicoechavarriam,,2022-05-13 01:59:17,1524932261400950000,4,31,3
" @risimo5 @QuinteroCalle Cuál todo Medellín ome bobo hp, ahora sí nos van a clavar un alza en los servicios públicos, ojalá después no te quejes.",MateoPuerta6,,2022-05-13 00:10:16,1524904827217760000,0,2,3
" @Claudia01070819 @QuinteroCalle Esperese doña ignorante. Que cuando desocupen las arcas de las empresas públicas de Medellín.y que es va a dar cuenta. A ver si va a sentir ese fresquito,cuando le suban los recibos de los servicios públicos.",PepeLazzo,"New York, NY",2022-05-12 21:00:18,1524857017348900000,0,0,3
" @Itsmargara @BluRadioCo Los habitantes de Medellín y el Valle de Aburrá nos está exprimiendo vía cuentas de servicios públicos para sostener las extravagancias, sobornos, publicidad y participación política del dictadorzuelo del piso 12, donde solo existe un concierto para delinquir. #QuinteroSeVa",Carlosacgonza,Colombia,2022-05-12 17:26:52,1524803306949960000,0,0,3
" @IvanDuque @CGR_Colombia revise facturación en los servicios públicos en medellín d estratos 4 -5 y 6 q están x las nubes, otros imptos y recursos q la nación ha entregado al alcalde para el desarrollo d la ciudad 👉👉👉@QuinteroCalle y petristas q utilizaron recursos en campaña d #Petro.",VERRI50,,2022-05-12 16:04:39,1524782615731090000,0,0,3
" @ArleyRe60817496 @QuinteroCalle @elpais_america Todo Medellín? Será ud y sus amigotes. Porque el resto está cansado de ese payaso. Solo con preguntar, por las basuras, los servicios públicos, la inseguridad. El grueso de la gente no quiere a ese señor. Por eso es que ayer les tocó obligar a los funcionarios a salir al planton",yeifery2,Bogotá,2022-05-12 13:30:20,1524743782234790000,0,0,3
 @jarizabaletaf Las promesas del disque alcalde de Medellín. Los servicios públicos cada día más caros 🙄. Este tipejo no es más que un pelele.,InesBetancur1,Colombia,2022-05-12 00:31:14,1524547716012990000,0,2,3
" @LarvaMonh La alcaldía de Federico hizo una de las mayores etapas de conexión de servicios públicos en la historia de Medellín ¿Federico de izquierda? Y Chocolate existe porque las alcaldías no son deficientes, vayan a defender al patrón que les paga a contratistas o gente del HGM, vayan,",YessidAlvarez,Medellín-Colombia,2022-05-11 19:24:58,1524470638836170000,0,0,3
" Los que viven en Villavicencio , Bogotá y Valle del Cauca creen que en Medellín la gente vive con los servicios públicos rebajados, con todo bonito",alejovr90,,2022-05-11 17:51:50,1524447201065380000,0,2,3
 @FajardoMadera @tigrenene @petrogustavo @CIDH Yo voté por Daniel Quintero callé porque nos prometió que iba a congelar los servicios públicos y muchas cosas más hoy me arrepiento de haber votado por este oportunista que tiene vuelta mierda a Medellín qué decepción,Cristia91148765,,2022-05-11 11:15:10,1524347376089150000,0,0,3
" @QuinteroCalle Este pendejo,piensa que los pobres de Medellin,tienen carro como el y que los cambios de velocidad dan para la comida,la vivienda,los servicios públicos y necesidades. Esto es deshonroso, vil, cínico y criminal. Los pobres no tenemos carro y solo queremos comer no montar en carro",DRPEDROORTIZ,NEW YORK & Alaska,2022-05-11 06:33:55,1524276597024600000,0,1,3
" Me parece FANTÁSTICO! ese alcalde desde hace MESES viene haciendo campaña a FAVOR d @petrogustavo, no tan solo con sus declaraciones d Twitter sino q incluso ha MANIPULADO descaradamente los servicios públicos d Medellín al servicio d la campaña petrista. Me encanta esta noticia!",MagdSeRespeta,,2022-05-11 03:39:24,1524232681185290000,1,7,3
 @poIiacriIamide Del alza desmesurada de los servicios públicos en Medellín es que Quintero saca la plata para aportarle los mil millones de pesos que se gasta la campaña de Petro cada día.,juanrobot4,Colombia,2022-05-11 01:28:51,1524199826526720000,0,0,3
" Este fin de semana en la Universidad de Medellín, @UdeMedellin_ especialización de administrativo; los servicios públicos en el núcleo del derecho administrativo.",carlosateho,,2022-05-10 16:59:06,1524071544695430000,0,4,3
 📣Actualiza tus conocimientos en materia de #ServiciosPúblicos. Conoce como hacerlo en la #Especialización donde trabajamos para #transformamoslosserviciospúblicos ¡Inscripciones abiertas! 🤳https://t.co/qtxMzPynCE 👉https://t.co/fOI3r2M3HG @EnelColombia #Colombia #Medellin,DerEconomico,"Bogotá, D.C., Colombia",2022-05-10 14:16:20,1524030580039560000,1,2,3
" Denuncia. Los servicios públicos en Medellín, siguen subiendo y de manera preocupante. Yo pagaba el año pasado 170 y miren en lo que van. También hay un aporte ""voluntario"" que lo suman en el primer total.... En mi casa con 2 habitantes y uno permanece fuera en el día. 🤔",Raquelvelez2016,Colombia,2022-05-10 13:36:49,1524020638587020000,0,1,3
" Y de repente Medellín por obra y gracias de “el cambio” volvió a ser un pueblo. Inundaciones, suspensión de servicios públicos. Lo más seguro es que estos son los aguaceros más fuertes de la historia. Ese es el cambio en EPM. Ese es el cambio de pinturita",bebagenovevas,"Marinilla, Colombia",2022-05-09 23:11:16,1523802815960860000,0,1,3
" Está mañana en el Centro de Medellín estaban entregando material para reciclaje de la campaña de GP, le dije no señor que tal por Dios se me quema la mano. 🤣🤣🤣",mpaulina12,,2022-05-17 21:25:25,1526675280915570000,0,1,5
" #Medellín | Este 17 de mayo se conmemora el Día Mundial del Reciclaje, una fecha para tomar conciencia del manejo de residuos.",EnTertulia_,"Medellín, Colombia",2022-05-17 16:36:36,1526602594231150000,0,0,5
" #Medellín | Este 17 de mayo se conmemora el Día Mundial del Reciclaje, una fecha para tomar conciencia del manejo de residuos.",TotusTVDigital,"Medellín, Colombia",2022-05-17 16:36:04,1526602460667830000,0,0,5
" La dueña de Medellín!! ¿Que tal ésta enferma? Utilizando siempre a la comunidad LGBTIQ+ y otras comunidades con inclusión para hacer política. Así son ellos, los de izquierda, puro populismo de reciclaje.",martello_carmen,"Buenos Aires, Argentina",2022-05-13 15:30:59,1525136531064770000,0,1,5
" @pipear83 @andreanimalidad @petrogustavo Falsoo que alcalde saco de circulación a las llamadas zorreras, gente que usaba los caballos para cargar los carretas con reciclaje,que alcalde se atrevio a cerrar la santamaría fue petro , mientras fajardo como Alcalde de Medellín 🤔🤔🤔🤔",nelsiton12,Bogota,2022-05-12 15:30:19,1524773975896770000,1,27,5
" @flaorrego @arqfada @cynthiayanesc “Merecíamos embriagarnos de progreso, ahora necesitamos revisarnos” Medellín, urbanismo y sociedad. Ojalá no haga falta una etapa de crisis extrema para que retomemos el camino del diálogo social amplio y serio sobre nuestros retos. @lab_mde",PerezJaramilloA,Colombia,2022-05-18 02:21:45,1526749853526760000,2,1,8
" @QuinteroCalle Dizque Medellín, la joya latinoamericana del urbanismo social, pasando por semejante oso.",seb_gonzalez,Región de Maule - Chile,2022-05-16 23:41:45,1526347198891430000,0,0,8
" Yo voto por el que YA llevó el CAMBIO. El cambio es con: Educación Vivienda Empleo Salud Urbanismo Seguridad Equidad Dignidad Medellín y Antioquia ya lo vivieron, yo también lo quiero. #FajardoMurilloPresidente",jufito35,,2022-05-14 15:56:33,1525505354871850000,1,6,8
 Mucho se habla de Urbanismo social en #Medellín y es porque vivimos un renacimiento a través de inversión pública en infraestructura y vivienda digna para la población más pobre.¿Y quién lideró el Urbanismo social en Medellín?@sergio_fajardo #YoVotoFajardo,luisbernardov,"Medellín, Antioquia",2022-05-11 16:39:21,1524428959462610000,9,26,8
 Colores Arte y Urbanismo callejero Murales #Medellin,TeAmoValpo,Joya del Pacífico y Wanderers,2022-05-11 16:01:19,1524419389319220000,2,4,8
" Una investigación de la Universidad @EAFIT ayudó a configurar el consumo cultural en Medellín a través del análisis de las redes sociales. Tatuajes, grafiti, fotografía, urbanismo, arquitectura... se suman al mapa de tendencias artísticas en la ciudad.",La_network,Latinoamérica,2022-05-10 21:40:00,1524142233477270000,2,4,8
" #ACTUALIDAD || En 2020, Iván Duque lo integró en su gabinete como viceministro de Agricultura, en la dependencia de desarrollo rural.",diariocriterio,"Bogotá, D.C., Colombia",2022-05-16 02:40:00,1526029669895660000,6,5,9
" Nuestro #RectorUNIPAZ MSc. @oscaropa participó del acto de cierre en la Universidad Cooperativa de Colombia, sede Medellín de la iniciativa ""Pilas con el Futuro""y expuso lo más destacado del eje temático de “Desarrollo Rural” asignado a nuestra institución. #UnidosSomosMás",UNIPAZnoticias,"Barrancabermeja, Colombia",2022-05-12 16:39:10,1524791301325130000,1,3,9
" @FicoGutierrez La gente habla por hablar, mostrando su total desconocimiento en materia de bienestar animal y todo lo que hizo Fico por ellos cuando fue alcalde de Medellín. Si hay algo seguro, es del compromiso que este tiene con los animales.",LoMejorDeLos80s,,2022-05-18 00:01:08,1526714467261860000,0,0,10
 @ELTIEMPO Ojalá podamos navegar algún día en el Río Medellín. #MedioAmbiente @ParquesdelRio @AlcaldiadeMed #CambioClimático #MedellínFuturo #QuinteroSeQueda @Bogota #biodiversidad #LecturaRecomendada #FelizDomingo @EPMestamosahi #RedesSociales #TurismoNacional #SiguemeYTeSigo,gestormundial,Medellín-Colombia,2022-05-15 13:06:48,1525825024103440000,0,0,11
" El jardín botánico de Medellín me tiene cautivado. De algo más de 13 hectáreas, cuenta con centros de cultura y educación ambiental. Un museo vivo en el centro de la ciudad, con extraordinaria biodiversidad.",JAntonioTejada,Panama,2022-05-14 22:38:43,1525606561330170000,2,10,11
" Las luminarias que Medellín está estrenando se podrían describir, en términos generales, como ""asesinas de biodiversidad"". El calor y la luz que producen es tanto que matan cualquier animal que pase cerca. Impiden que toda la vida animal nocturna prospere.",MemoUrbanista,"Medellín, Colombia",2022-05-12 01:48:49,1524567237251990000,2,13,11
" @MagicThe0 @NoticiasRCN @santiagoangelp @petrogustavo @FicoGutierrez @ingrodolfohdez @sergio_fajardo Muy cierto sino mire a Medellín reconocida mundialmente por capital de innovación, energías limpias, desarrollo industrial, y a muchos de sus municipios cercanos, pujantes, trabajadores la mayoría con Gobernantes de derecha.",Cristia74747986,"Túquerres, Colombia",2022-05-11 03:26:41,1524229480688010000,1,1,12
" @VaneGonzalezMon @QuinteroCalle @juanduquega @camivillamizar @AlcaldiadeMed @AndreeUribeM @Karen_delgadom Que chevere para la Dama. De verdad Medellín con tantas necesidades de gestión por las calles con indigentes o vias , etc. y usted se paga un curso de inglés? No sabia que ya en Medellín se dejo el español. Se hubiera hecho un curso mejor de servicios públicos y hubiera ayudado +",betitoarias26,,2022-05-18 03:05:18,1526760815486960000,0,0,servicios
" @estebanrestre @QuinteroCalle Jajajajaja y en que Medellín vive usted? Pudriéndonos con las basuras, jardines vueltos matorrales, el mismo metro de siempre colapsado…. Y Epm fue algo de Duque. Por cierto qué pasó con el congelamiento de las tarifas de los servicios públicos?",DianaVanegasJ,Medellin,2022-05-18 01:45:46,1526740798506660000,0,0,servicios
" Pura paja… 1. Los servicios subieron, las polizas pagaron siniestro. 2. Valle del software, se les cayo el negocio con el lote de Lupe. 3. Ecociudad: la ciudad invadida por la manigua y las basuras. 4. La seguridad: Medellin mas insegura… .@QuinteroCalle 🤡",GioArrietaF,"Envigado, Colombia",2022-05-17 22:26:44,1526690710887580000,0,0,servicios
" @estebanrestre @QuinteroCalle Dijo que iba a congelar las tarifas de los servicios públicos….. oh sorpresa!!, hace dos meses subieron las tarifas. Pregunta: por donde pasa el metro subterráneo y el metro ligero en Medellín??",Juan_Tamayo,"Bogota, Colombia ",2022-05-17 21:47:17,1526680781774590000,1,1,servicios
" 15:47 #PrecauciónVial servicios de emergencia acuden a Vasco de Quiroga y Roberto Medellín en Santa Fe, permita su paso.",OVIALCDMX,"Liverpool #136, Col. Juárez",2022-05-17 20:47:51,1526665827063410000,0,2,servicios
" @NoticiasCaracol Los servicios públicos en Medellín, están por las nubes, asfixiados cada vez mas, no alcanza el dinero!",AnaMaraSnchezT3,,2022-05-17 20:36:07,1526662871572260000,0,0,servicios
" Con dinero casi todas las ciudades son agradables para vivir. Ahora, en conjunto a clima,vías,oferta de entretenimiento,comida y tamaño mas cobertura servicios públicos y salud pues: Bucaramanga Medellin Villavicencio",Sveralopez,Avenida Siempre Viva 742,2022-05-17 17:07:25,1526610351688660000,0,6,servicios
" Medellín. Secretaria de Gestión Humana y Servicios a la Ciudadanía, Ingrid Vanessa González, se aprobó, para ella misma, un apoyo de 5.7 millones para estudiar inglés en @EAFIT",Universidadcol,Colombia,2022-05-17 15:39:08,1526588136251340000,0,0,servicios
" #Denuncia | Lo dicho, la plata de nuestra Medellín es la caja menor de la administración de Quintero. La abusiva Secretaria de Gestión Humana y Servicios a la Ciudadanía, Ingrid Vanessa González, firmó resolución para aprobarse $5′700.000 para curso de inglés en Universidad Eafit",ValenciaGermanC,"Medellín, Colombia",2022-05-17 15:11:19,1526581134049550000,134,167,servicios
" Mañana tendremos nuestra segunda Comisión Accidental del año de Servicios Educativos, en la que abordaremos la situación de los colegios APP de Medellín. Invitamos abiertamente a la comunidad educativa, especialmente a los rectores y docentes, ¡bienvenidos a participar!",danielduquev,"Medellin, Colombia",2022-05-17 14:51:37,1526576177292390000,3,5,servicios
" TRIBUNAL SUPERIOR DE MEDELLIN - HONORARIOS PROFESIONALES. Pretende el demandante, le sean los reconocidos los honorarios pactados en contrato de prestación de servicios por representación judicial en proceso divisorio.",LexBase,Colombia,2022-05-17 14:00:33,1526563324565070000,2,1,servicios
" La Secretaria de Gestión Humana y Servicios a la Ciudadanía de Medellín, Ingrid Vanessa González, se vio envuelta en un escándalo.",RevistaSemana,Colombia,2022-05-17 13:37:44,1526557582734860000,0,1,servicios
 #Medellín Buen Comienzo culminó el traslado de la sede ubicada en Villa Hermosa para mejorar la atención para 180 niños que se benefician de los servicios del programa.,CaracolMedellin,"Medellín, Antioquia",2022-05-17 12:57:37,1526547488643110000,0,3,servicios
" 📣Diligenciando esta encuesta, Medellín medirá avances en calidad de vida, forma de habitar el territorio, servicios, tecnología y más.🌆 ¿Ya la llenaste? 👇 Súmate y junto al @Ministerio_TIC construyamos una ciudad ➕ inteligente.🚀",Sebastian_TIC,Medellín,2022-05-17 12:25:53,1526539501451020000,3,2,servicios
" Las ferias de servicios se realizarán entre las 9:00 a. m. y la 1:00 p. m., así: San Sebastián de Palmitas: martes 17 de mayo @maryo_london #medellin #comunas #rural #corregimientos #webstories @alcaldiademed",ComunasMed,Medellin,2022-05-17 10:00:00,1526502789932790000,0,0,servicios
 Allá en Medellín Los servicios públicos Que el suspendido @QuinteroCalle prometió rebajar Es verdad han subido el doble Esta cuenta que antes llegaba entre $ 690.000 y $ 750.000 miren este mes cuanto a llegado @QuinteroCalle Medellín te pregunta.......,Ciclope2021,algún lugar del mundo ,2022-05-17 02:13:16,1526385329548280000,1,0,servicios
" La Secretaria de Gestión Humana y Servicios a la Ciudadanía de Medellín, Ingrid Vanessa González, firmó una resolución que le permitió aprobarse recursos para un curso de inglés de la Universidad Eafit.",elespectador,"Bogotá, Colombia",2022-05-17 01:55:02,1526380741369770000,32,46,servicios
" #ciudad | La Secretaria de Gestión Humana y Servicios a la Ciudadanía de Medellín, Ingrid Vanessa González, firmó una resolución que le permitió aprobarse recursos para un curso de inglés de la Universidad Eafit.",2020noticiasC,Medellín,2022-05-17 00:47:24,1526363723388140000,0,1,servicios
" la Secretaria de Gestión Humana y Servicios a la Ciudadanía de Medellín, Ingrid Vanessa González. Ella misma aprobó $5′700.000, mediante la firma de una resolución que le permitiría estudiar ingles en la Universidad Eafit financiada con recursos públicos.",Oigalean,"Cali, Colombia",2022-05-17 00:35:47,1526360800734160000,0,0,servicios
" #Regionales #Educación #Pais • Encontraron inconsistencias en un curso de inglés que tomará la Secretaria de Gestión Humana y Servicios a la Ciudadanía de Medellín, Ingrid Vanessa González. Ella misma aprobó $5′700.000, mediante una resolución para estudiar en la U. Eafit.",Soyquintopoder,Valledupar- Cesar,2022-05-16 23:03:09,1526337487869820000,1,0,servicios
 @LucasAcevedoM @DuvanGraciano2 La cucuteña Villegas si conoce los barrios de Medellín?No me haga reír hombre.Quintero fracasó en ser concejal de Bogotá y le regalaron la alcaldía de Medellín.Quién?Un poder oscuro que quiere acabar con la mejor ciudad del país.O por qué contrata los servicios de aseo con rolos?,Tuberquia3,"Medellín, Antioquia, Colombia",2022-05-16 22:27:15,1526328452118370000,0,0,servicios
 Con la imposición de este nuevo Alcalde se busca retornar a Medellín a la precariedad de servicios y sobretodo a la Política del terror. Viene la restauración. Hay que organizar la lucha.,TerroristaExtre,Colombia,2022-05-16 22:21:12,1526326928042500000,0,0,servicios
 Reunión @MigracionCol en Medellín permitirá avanzar en oferta de servicios unificada para retornados y familias mixtas. @ColombiaNosUne de @CancilleriaCol trabaja de la mano de entidades #EnTerritorio para ofrecer más y mejores servicios de la mano de @OIMColombia,CDCordobaR,"Bogotá, D.C., Colombia",2022-05-16 21:24:16,1526312603584270000,2,3,servicios
